{
  "schema_version": 2,
  "command": "status",
  "context": "empire",
  "observations": [
    {
      "provider": "ssh",
      "profile": "empire-alpha",
      "expected_identity": "researcher@example.invalid",
      "observed_identity": null,
      "identity_match": "unverified",
      "session_usability": "indeterminate",
      "reason": "insufficient_evidence",
      "reauthentication_need": "unknown",
      "evidence_level": "local_metadata",
      "provider_contacted": false,
      "transport_reuse": "active",
      "observed_at_unix": 0
    }
  ]
}
